{
  "kind": "diffdevil.query",
  "schemaVersion": "1.0",
  "semantics": {
    "language": "diffdevil-expr/1",
    "numbers": "diffdevil-number/1",
    "replacementLines": "replacement-lines-v1",
    "paths": "diffdevil-glob/1",
    "presets": [
      "size@1"
    ],
    "limits": "diffdevil-limits/1"
  },
  "reportId": "fixture-report-exact",
  "value": {
    "kind": "collection",
    "items": [
      {
        "membership": "definite",
        "value": {
          "kind": "string",
          "value": "src/Foo.cs"
        }
      }
    ],
    "unseen": {
      "possible": false,
      "minimum": 0,
      "maximum": 0
    },
    "order": "known"
  },
  "evidence": []
}
