{
  "kind": "diffdevil.query",
  "schemaVersion": "1.0",
  "semantics": {
    "language": "diffdevil-expr/1",
    "numbers": "diffdevil-number/1",
    "replacementLines": "replacement-lines-v1",
    "paths": "diffdevil-glob/1",
    "presets": [
      "size@1"
    ],
    "limits": "diffdevil-limits/1"
  },
  "reportId": "fixture-report-bounded",
  "value": {
    "kind": "number",
    "numericType": "integer",
    "measurement": {
      "status": "bounded",
      "lower": 60,
      "upper": 70
    }
  },
  "evidence": [
    {
      "code": "PATCH_INCOMPLETE"
    }
  ]
}
